<?xml version="1.0" encoding="UTF-8"?>
<xs:schema xmlns:xs="http://www.w3.org/2001/XMLSchema">
    <xs:element name="tienda">
        <xs:complexType>
            <xs:sequence>
                <xs:element name="ticket" maxOccurs="unbounded">
                    <xs:complexType>
                        <xs:sequence>
                            <xs:element name="dependiente" type="xs:string" />
                            <xs:element name="articulo" minOccurs="1" maxOccurs="unbounded"  type="xs:string"/>
                        </xs:sequence>
                        <xs:attribute name="id" type="xs:ID" use="required" />
                        <xs:attribute name="tienda" type="xs:string" use="required" />
                        <xs:attribute name="fecha" type="xs:date" />
                        <xs:attribute name="hora" type="xs:time" />
                    </xs:complexType>
                </xs:element>
            </xs:sequence>
        </xs:complexType>
    </xs:element>
</xs:schema>